.id,date,text,start,end,speakernum,publisher,pub
644c3351a8570327af42a6b2f4ecfb11e67971e7d5903681f4682c3b,2023-11-14T00:00:00Z,"Foudloos rekenen in 12 weken, nu ook online. Boek nu een proefles op foudloosrekenen.nl.",1772.5551782682514,1777.9202037351442,SPEAKER_14,sven,sven2023-11-14
3c748534980af5b15b4eb5c86b9f35969a06b2f7b490cb3972c4a12a,2023-11-14T00:00:00Z,"De mysterieuze dood van de 17-jarige Cassandra liet schrijver Ninia Weijers niet los.

 Hoe vertel je het verhaal als niemand weet wat er is gebeurd?

 Cassandra, het nieuwe boek van Ninia Weijers. Nu in de boekhandel.",1779.3972835314094,1792.877758913413,SPEAKER_07,sven,sven2023-11-14
8e5e2fd33b2dc44d618adaf432830dad53e2ec32107ff9059757d312,2023-11-14T00:00:00Z,12 uur. NPO Online.,1797.9202037351442,1799.9915110356535,SPEAKER_03,sven,sven2023-11-14
