.id,date,text,start,end,speakernum,publisher,pub
5c3e2743022a3680a14e0ba31031e807851056beff99b05857a1aa02,2023-11-08T00:00:00Z,"Nee, natuurlijk niet.

 We zijn principieel tegen het geven van verantwoording aan andere Kamerleden.

 Iedereen kan zien wat we doen via de Kamer van Koophandel.

 Gideon Vermeijeren wordt zelfs geschorst...

 omdat hij ook statenlid is.

 Er is echt niemand die niet weet dat hij statenlid is.

 Het is puur en alleen een machtspelletje.

 Waar ze mee bezig zijn is om de Tweede Kamer...

 tot een normale werkplek te maken.

 Daarom dat ze het hebben over collega's.

 We zijn geen collega's, we zijn ambtsgenoten.

 En we zijn aan niemand anders verantwoording verplicht dan aan de kiezer.

 En daarom is het een principiële kwestie.

 Wij delen onze agenda niet.

 We vertellen niet met wie we afspraken hebben.

 We delen geen reizen.

 Dat zijn allemaal dingen die ze willen weten om ons te kunnen controleren.",9375.06791171477,9422.691001697793,SPEAKER_26,journaal,journaal2023-11-08
ba4b79eec0fa441df70bb4853bbb584cbf64c784f27353457a985fbb,2023-11-08T00:00:00Z,Maar de Tweede Kamer heeft het ingesteld vanwege integriteit.,9420.755517826829,9426.37521222411,SPEAKER_126,journaal,journaal2023-11-08
71fabb29f2ecd172f9c82f553ea1643faec7d846869c0f00169caf6e,2023-11-08T00:00:00Z,Daarom willen ze dat iedereen daar transparantie in betracht.,9426.81663837012,9429.651952461802,SPEAKER_126,journaal,journaal2023-11-08
06a12237811e3f791b4352a853aedd1b01cece3bf8cb372f1ded5389,2023-11-08T00:00:00Z,"Ja, dat is onzin.

 Het heeft helemaal niets met integriteit te maken...

 of jij ook statenlid bent of je met iemand afspreekt.",9429.651952461802,9438.140916808152,SPEAKER_26,journaal,journaal2023-11-08
51dbe0c0932d58c31d1d9855003912223c59d95369266288e53d049a,2023-11-08T00:00:00Z,"Nee, maar wel of je misschien inkomsten uit andere bronnen hebt.",9437.342954159594,9441.536502546687,SPEAKER_126,journaal,journaal2023-11-08
1f3d16e222012a299adfdeb5b5ff1649f3e14ab090b98c0d164c6de4,2023-11-08T00:00:00Z,"Flauwekul. Ik geloof daar helemaal niks van.

 Het is een voorwensel om het ambt van kamerlid te onderwerpen...

 aan een ambtelijke, bureaucratische cultuur.",9440.738539898131,9452.572156196944,SPEAKER_26,journaal,journaal2023-11-08
1ae83895d02f4e4fb95e1def5846ffedfdd7a3d57e42ac05d189f672,2023-11-08T00:00:00Z,"In uw verkiezingsprogramma staat een aantal bekende standpunten.

 Zoals een migratiestop, een vertrek uit de Europese Unie...

 een vertrek uit de euro, een beëindiging van het klimaatbeleid...

 en ook een beëindiging van de maximumsnelheid.

 En daarnaast is vrijheid een veel voorkomend begrip in dat programma.

 Ik geloof dat het 1, 22 keer voorkomt als je Google Search er even op loslaat.",9453.998302207132,9477.00339558574,SPEAKER_104,journaal,journaal2023-11-08
2d6864038c7ec9b625dc01f824da6582a197a29b5ea4d61059596709,2023-11-08T00:00:00Z,"Wat bedoelt u met vrijheid?

 Vrijheid betekent dat er minder greep moet zijn van de overheid...

 op de levens van burgers.

 We hebben natuurlijk een lockdown gehad.

 We hebben anderhalf jaar gevangen gezeten.

 Dat was een enorme misbruik van macht dat de staat heeft laten zien.

 Sindsdien is het alleen maar erger geworden met censuur...

 met een enorme toename van de belastingen.

 Het Nederlands houdt er bijna niets meer over.

 Het is voor alles bijna afhankelijk van subsidies en cadeautjes van de staat.

 En wij willen dat allemaal omdraaien.

 We willen dat er veel meer ruimte komt voor het individu.

 We willen ook dat je harder mag rijden op de snelweg.

 We willen minder regels.

 En geldt die vrijheid dan voor iedereen?

 Ja, natuurlijk. Wij zijn een echte middenstandspartij, middenklasse.

 Wij willen dat de gewone Nederlander weer veel meer armslag krijgt...

 veel meer ruimte krijgt.",9476.001697792872,9526.001697792872,SPEAKER_26,journaal,journaal2023-11-08
10e95b4088aa7ac476fc412dac143b62c8e8d0279ad891ea3fbff30c,2023-11-08T00:00:00Z,"Maar u wilt bijvoorbeeld ook sommige groepen uw normen opleggen.

 Want in het onderwijs wilt u bijvoorbeeld geen lessen over gender.",9526.001697792872,9533.35314091681,SPEAKER_104,journaal,journaal2023-11-08
36ba2495d5653b1092e25360dce79ecc82bdfb43a964e5e72ef3fe22,2023-11-08T00:00:00Z,"Ja, dus wij vinden de vrijheid van het kind om gevrijwaard te blijven...

 van seksuele verwarring, transgender-indoctrinatie...

 maar ook van klimaatpropaganda heel belangrijk.

 Wij vinden dat de jeugd daar niet mee moet lastigvallen.

 Maar u grijpt dan ook in in de vrijheid van docenten die voor de klas staan?",9534.456706281837,9552.283531409168,SPEAKER_26,journaal,journaal2023-11-08
4e5215b0aaa60269c2f4071c453cbb803107247dce8c0ecf2fc16c5c,2023-11-08T00:00:00Z,"Ja, er zijn natuurlijk bepaalde grenzen.

 Vrijheid is nooit onbeperkt.

 Je mag ook niet een anders eigendom afpakken.

 Dat is ook inperking van vrijheid, dat is waar.

 Maar wie bepaalt dan waar hier de vrijheid ligt?

 De politiek, daar gaan verkiezingen over.

 Dus wij willen dat mensen veel meer geld overhouden in hun portemonnee...

 dat ze veel meer vrijheid hebben om te doen wat ze willen.

 En dat we stoppen met de transgender-indoctrinatie van kinderen.

 Vanaf je elfde mag je nu hormoonblokkers nemen.

 Dat betekent dat je permanent onvruchtbaar wordt.

 Dat wordt gewoon aangereikt aan kinderen.

 Wij vinden dat heel onverstandig.",9553.55687606112,9588.870967741936,SPEAKER_26,journaal,journaal2023-11-08
7d0bdc1d493049f02421117a11e5d19f647d332a83704b264887e155,2023-11-08T00:00:00Z,"Aangereikt, daar zit een heel medisch traject achter.",9588.480475382004,9591.129032258064,SPEAKER_126,journaal,journaal2023-11-08
f52424d14499e5c874dc05b66e9907094569983deb9783605c157320,2023-11-08T00:00:00Z,"Ja, medisch traject op je elfde. Kom op zeg.",9591.23089983022,9592.996604414264,SPEAKER_26,journaal,journaal2023-11-08
edba6aaebd1b4f599355044f5078ed4c3bf4cd564e68da6eff29af1e,2023-11-08T00:00:00Z,Dat gebeurt niet zomaar.,9593.132427843804,9593.998302207132,SPEAKER_126,journaal,journaal2023-11-08
ca733d7e72580990e48d24d0be2d8c49cd6e4f13880310cf3ac74828,2023-11-08T00:00:00Z,"We hebben een luisteraarsvraag van Wilbert.

 Die zegt, geachte heer Baudet, ik ben benieuwd naar uw visie...

 ten aanzien van het beschermen van burgers.

 Bijvoorbeeld gokken, economisch voorkomen van verslaving en PFAS.

 Gezondheid. Moet de overheid zich hierin mengen?",9593.998302207132,9610.5857385399,SPEAKER_104,journaal,journaal2023-11-08
341a5117113b22bd9a52713473f20b2b2284c706ee226d249a00f2d7,2023-11-08T00:00:00Z,"Nou, ja, kijk, natuurlijk is het belangrijk...

 dat je mensen vanaf hun achttiende vrijlaat...

 en tot hun achttiende bepaalde dingen verbiedt of ontmoedigt.

 Bijvoorbeeld drugsgebruik, bijvoorbeeld gokken.

 Maar er zijn ook veel dingen die beschouwd worden als een gevaar...

 wat het helemaal niet is.

 Dus PFAS, stikstof, CO2-hype...

 dat zijn helemaal geen dingen die bedreigend zijn voor ons welzijn.

 Dat zijn eerder dingen die een soort bureaucratische werkelijkheid zijn geworden...

 waar onze hele samenleving door plat komt te liggen.

 Dus het is heel belangrijk om scherp te kijken...

 wat is nou daadwerkelijk een bedreiging voor onze samenleving en wat niet.

 En heel veel van die klimaat- en milieu-dingen zijn helemaal geen bedreiging.",9611.994906621392,9656.37521222411,SPEAKER_26,journaal,journaal2023-11-08
19c1ce4904110f08b4e864fd5615fc96b415f572a08e89aa9966a9e9,2023-11-08T00:00:00Z,"Maar goed, deze luisteraar noemt een concreet voorbeeld, bijvoorbeeld PFAS.",9656.37521222411,9659.651952461802,SPEAKER_126,journaal,journaal2023-11-08
1b63bd55d6287b0d27c38bb49878d3e18a3fff035f8bfb9304a18e70,2023-11-08T00:00:00Z,"Ja, het wordt schroomlijk overdreven, de impact daarvan.

 En dat is ook iets wat ineens uit de hoge hoed wordt getoverd.

 Totale bouwstop, de hele industrie komt op de rug te staan.",9659.77079796265,9670.04244482173,SPEAKER_26,journaal,journaal2023-11-08
a6b775e2459400eb99c478513d4dfb694ba4336ca6d17572f7bdfa58,2023-11-08T00:00:00Z,"Dat is niet ineens, want bijvoorbeeld Gemoers in Dordrecht...

 weet al jaren dat ze veel te veel PFAS uitstoten.

 Hij heeft maatregelen genomen om zwangere vrouwen...

 bijvoorbeeld niet in die fabriek te laten werken.

 Juist vanwege het gevaar van PFAS.

 En ondanks dat ze dat wisten, gingen ze maar door.

 Dus dit is niet uit de lucht komen vallen.",9669.21052631579,9690.195246179966,SPEAKER_126,journaal,journaal2023-11-08
2f2c9b0dbfda07ea7d5131a681cb87d47282f64d77c06f8b39784d58,2023-11-08T00:00:00Z,"Ze weten het al sinds de jaren 70.

 Wat we weten sinds de jaren 70 is dat er allerlei stoffen...

 en allerlei dingen van invloed zijn op de gezondheid van mensen.

 Dat is evident.

 Alleen de mate waarin dat zo is, wordt enorm overdreven.

 Gemoers noemt u, maar Tata is een ander voorbeeld.

 Dat is gewoon de beste staalfabriek ter wereld.

 En wat je zou kunnen doen, is daar een aantal...

 Bij één of twee schoorsteden zijn een aantal dingen bouwkundig misgegaan.

 Dat kun je herstellen.

 Maar wat we nu aan het doen zijn, is het kind met het badwater weggooien.

 We zijn ons hele land aan het de-industrialiseren.

 En dat is totaal niet nodig. We zitten echt in een kramp.",9686.25636672326,9726.629881154498,SPEAKER_26,journaal,journaal2023-11-08
496d357343c175357eb5f5944f3643e6592603b9009833e38e0a710b,2023-11-08T00:00:00Z,"Zegt u nu eigenlijk tegen de mensen die daar wonen...

 jammer dan dat u last van heeft met uw gezondheid?",9725.220713073006,9731.655348047538,SPEAKER_126,journaal,journaal2023-11-08
29044fddbd2feb585bd1a74cabbceaecc6256f74734a69db556bddcb,2023-11-08T00:00:00Z,"Nee, de natuur is er uitstekend aan toe in de omgeving.",9727.241086587435,9737.156196943975,SPEAKER_26,journaal,journaal2023-11-08
91928452c8e3464239db7e516deae296af85fb44dd06ed4b1dfba3bc,2023-11-08T00:00:00Z,U ontkent gewoon dat ze er last van hebben?,9736.290322580648,9737.869269949068,SPEAKER_126,journaal,journaal2023-11-08
bbb611fd27b1bba60a7ffe1315656412c640667507abc142c289aa7f,2023-11-08T00:00:00Z,"Nee, er zijn mensen...

 Er zijn één of twee keer per jaar is er een wind en uitstoot...

 En bovendien, er is één schoorsteen...",9737.869269949068,9747.156196943975,SPEAKER_26,journaal,journaal2023-11-08
559837d82c620316106b4b019dc9c89abf788bc5bc9489004b3ec653,2023-11-08T00:00:00Z,Een keer per jaar is er wind en uitstoot?,9745.865874363328,9747.614601018677,SPEAKER_126,journaal,journaal2023-11-08
0b733740a07fce2f99217810cb00662e508a9f1f47d48d3af857deb6,2023-11-08T00:00:00Z,"Ja, maar er is één of twee schoorstenen...

 in één of twee fabrieken van het hele complex van Tata.

 En daar is een bouwfout gemaakt.

 En dat kost enkele tientallen miljoenen om dat te repareren.

 Wat ze nu willen doen, is voor één miljard die hele fabriek gaan sluiten...

 of groen gaan maken. Wat helemaal niet kan.

 Dat is de gekte waar we in zitten in Nederland.",9747.614601018677,9767.597623089983,SPEAKER_26,journaal,journaal2023-11-08
e3b8bbcebc22a307ba2407a27dfe4dc71ec0ff205908119dbc225c24,2023-11-08T00:00:00Z,"Meneer Baudet, we moeten het over Rusland hebben.

 We moeten niks, maar dat is prima.

 Wij willen het over Rusland hebben.

 Uw partij is de enige partij in de Tweede Kamer...

 die zich falicant keert tegen Oekraïne.

 U bent tegen wapenleveranties aan dat land.

 U bent tegen sancties tegen Rusland.

 En u vindt dat Poetin gelijk heeft.

 U heeft hem zelfs een held genoemd.

 Worden dat ook nog even voorbij kan. Waarom?",9767.597623089983,9788.44651952462,SPEAKER_104,journaal,journaal2023-11-08
d7b98898e697501fe53aa156204cc6f0911a2c17a968d494be996cc5,2023-11-08T00:00:00Z,"Nou, ik ben niet tegen Oekraïne. Ik ben voor vrede.

 En dat is al het begin van Forum voor Democratie geweest.

 In 2016 hebben wij een referendum geleid...

 over het associatieverdrag met Oekraïne.

 Wat het begin was van deze noodlottige oorlog.

 U hebt Poetin een held genoemd. Hij is die oorlog begonnen.

 Waarom hebt u hem een held genoemd?

 Het is een beetje spreektaal natuurlijk.

 Maar wat ik bewonderenswaardig vind aan Poetin...

 is ten eerste dat hij Rusland opnieuw heeft opgebouwd...

 vanaf het jaar 2000, toen het volledig in puin lag.

 En vervolgens is hij de enige grote wereldleider...

 die zich richt tegen de LGBT-propaganda.

 Hij heeft vrede gebracht in Syrië en ISIS verslagen.

 En hij richt zich tegen het World Economic Forum...

 en de plannen van Klaus Schwab. Dat vind ik een bewonderenswaardig element.",9789.991511035656,9834.269949066216,SPEAKER_26,journaal,journaal2023-11-08
8729dfa64c76c4df15c9a9bdb4b618252c932427f6f0df4713c053e6,2023-11-08T00:00:00Z,"Maar door die aanval van Rusland op Oekraïne...

 zijn daar inmiddels 70.000 doden gevallen en 100.000 gewonden.

 Het oosten van Oekraïne is in puin gebombardeerd.

 En u hebt gezegd, het is het meest hoopvolle wat ik ooit heb meegemaakt.",9833.217317487266,9847.971137521225,SPEAKER_104,journaal,journaal2023-11-08
d1aa14b0b528c07903e8971a5b9ada508818e21ba5a20ddd5fccb595,2023-11-08T00:00:00Z,"Nou, het is natuurlijk vreselijk dat die oorlog er is.

 Ik denk alleen dat Rusland defensief handelt.

 Want het punt is namelijk dat de NAVO is opgerukt...

 tegen alle afspraken in met een heel offensieve agenda...

 van regime change.

 Maar u bent zo voor vrijheid, maar de Oekraïners verliezen hun vrijheid.",9847.971137521225,9868.786078098474,SPEAKER_26,journaal,journaal2023-11-08
cbda66fba75d10423e352b7bc488cc979e595e47a2cb8897f244a581,2023-11-08T00:00:00Z,"Het zou het beste zijn als de Oekraïners niet geleid zouden worden...

 door een marionet van het Amerikaanse imperium...

 namelijk Volodymyr Zelensky, en zouden denken aan hun eigen belang.",9869.46519524618,9883.48896434635,SPEAKER_26,journaal,journaal2023-11-08
7bd8ecaba7a96666e8f0e3890c3950236a3d807d9b4d90c0352bd9b8,2023-11-08T00:00:00Z,Maar hoe komt het er dan bij dat het een marionet is?,9881.672325976231,9884.966044142617,SPEAKER_104,journaal,journaal2023-11-08
99abeaf6a68dfc1de9b432ea9065104a7555d68859f6bfe1b51b9afb,2023-11-08T00:00:00Z,De Amerikanen hebben hem alleen maar aangeboden om hem daar weg te halen.,9884.134125636672,9887.00339558574,SPEAKER_26,journaal,journaal2023-11-08
50c6281787ca192d1383c1e63d3b9e745aadbe0eb85c16d75de9b975,2023-11-08T00:00:00Z,"Die wapenleveranties zijn allemaal pas veel later op gang gekomen.

 Het is totaal niet in het belang van Oekraïne om bij de NAVO te komen.

 Het is totaal niet in het belang van Oekraïne om deze oorlog te voeren.

 Rusland wil vrede. Er ligt ook gewoon een vredesvoorstel.

 Er zijn steeds vredesvoorstellen geweest.

 De Amerikanen houden dat tegen omdat het militair-industrieel complex...

 er zoveel geld aan verdient. Het is echt afschuwelijk.",9888.667232597623,9910.806451612903,SPEAKER_26,journaal,journaal2023-11-08
83c17bc382a838b9659b14e45f453d9bd98d1c0358df09177b8f29c7,2023-11-08T00:00:00Z,"Rusland is geen democratie meer te noemen.

 Politieke tegenstanders van Poetin verdwijnen in de gevangenis.

 Of ze worden vermoord of ze vallen uit een raam.

 Vanwaar dan toch die steun voor Poetin? Er is geen vrijheid in Rusland.",9909.125636672328,9922.6740237691,SPEAKER_104,journaal,journaal2023-11-08
9827baa23f9f289140289b9073e893949fb58290a9432f4d447d8acd,2023-11-08T00:00:00Z,"Er zijn hele grote problemen in Rusland...

 en er zijn hele grote kanttekeningen te plaatsen bij Poetin...

 en bij de regering van Poetin. Dat ontken ik helemaal niet.

 Waar het om gaat is wat de betekenis internationaal van deze situatie is...

 en wat kunnen we doen om vrede te brengen.

 De huidige oorlogszucht van het Westen is heilloos.

 Er gaan alleen maar meer Oekraïners zinloos dood.

 Laten we om tafel gaan. En we hebben ook in ons verkiezingsprogramma staan...

 dat Nederland daar een voortrekkersrol in kan spelen.

 En dan moet je dus niet met die oorlogstaal van D66 enzovoorts verder gaan.

 Met tribunalen en dat soort dingen allemaal.

 Maar je moet gewoon zeggen om tafel hoe kunnen we dit oplossen.

 Rusland wil vrede. Rusland heeft totaal niet de intentie...

 om deze oorlog te voeren. Het is een noodlottige oorlog...

 waar ze zich noodzak voelden om dat te doen.

 Omdat ze met de rug tegen de muur werden gedrukt door die agressieve NAVO.

 U gaat natuurlijk over uw eigen woorden, maar u vertolkt hier...

 een op een de boodschap van het Kremlin.",9922.6740237691,9980.297113752124,SPEAKER_26,journaal,journaal2023-11-08
4e1e28e5587c399be907c34db692abff3ec9c9a72e8bde7271cd652a,2023-11-08T00:00:00Z,"Dat zou kunnen. Ja, ik vind dat geen argument of zo.",9981.196943972836,9985.933786078098,SPEAKER_26,journaal,journaal2023-11-08
47943c6ae9df81e7af192f47ac0410eeba40ac7817bbc5183e6ff0ee,2023-11-08T00:00:00Z,"Als dat zo is, betekent dat dat ik daarmee ongelijk heb in uw ogen?

 U zegt ik kan morgen vrede zijn.",9987.597623089983,9994.847198641768,SPEAKER_26,journaal,journaal2023-11-08
70270ad934191e220042abe1de32bc7adcc71fe7af6d3b5d2fba94a8,2023-11-08T00:00:00Z,"Maar dat betekent dat Oekraïne zich moet neerleggen bij de Russische bezetting.

 Is dat dan vrijheid?",9993.336162988116,9999.719864176572,SPEAKER_104,journaal,journaal2023-11-08
486f25b2bada54203f542829397b26180e3aa9ddf79e48bcbeddbc5e,2023-11-08T00:00:00Z,"Nou, niet bij de Russische bezetting.

 Wat Rusland wilde... Rusland wil Oekraïne inlijven?

 Nee, dat is nooit een oorlogstoel geweest van Rusland.

 Daarom stonden de tanks toch aan de stadsmuur van Kiev?

 Daarom hebben ze Kiev ook niet ingenomen omdat er toen een vredesvoorstel lag.

 Omdat ze het niet konden? Nee, helemaal niet.

 Rusland heeft zich teruggetrokken omdat het Westen toen zei...

 oké, nu gaan we vrede stichten.

 Rusland ziet Oekraïners als een broedervolk.

 Zoals Nederlanders Vlamingen zien.

 Zij willen daar helemaal geen oorlog.

 Maar de Amerikanen dwingen hen tot die oorlog.

 Omdat Amerika nog altijd het regime van Rusland...",10001.740237691003,10039.533106960953,SPEAKER_26,journaal,journaal2023-11-08
dacb3fa3bbfbefc69bc26f31424585eda8abde0b3e138b14b386e97a,2023-11-08T00:00:00Z,"of Rusland überhaupt, wil vernietigen, ten val wil brengen.

 En wij moeten eens inzien dat wij mede verantwoordelijk zijn...

 daardoor voor al dit zinloze bloedvergieten.",10039.97453310696,10049.651952461802,SPEAKER_26,journaal,journaal2023-11-08
ed236a023d88f660672235d99ef121e969ebf1bc7acb61493ea46235,2023-11-08T00:00:00Z,Alleen de Oekraïners zien de Russen niet meer als een broedervolk.,10049.719864176572,10054.134125636672,SPEAKER_126,journaal,journaal2023-11-08
2a5ef3f8917f05a6db0a82d11d386e304505c3dfb0658da6e046da00,2023-11-08T00:00:00Z,"De Oekraïners? Het is een zeer verdeeld land.

 Het is een verscheurd land. De meeste Oekraïners.",10054.134125636672,10061.60441426146,SPEAKER_26,journaal,journaal2023-11-08
8d6bfd9fabf1a3e25fa4d2388722c3fb273d472030d55eebc50a71cb,2023-11-08T00:00:00Z,"De meeste? Heeft u een telling gedaan?

 Er zijn heel veel Oekraïners die vechten voor hun land.

 En die daarvoor sneuvelen. Dat is ook zo.",10054.456706281837,10067.13921901528,SPEAKER_126,journaal,journaal2023-11-08
f27f8101413ef7b4f5893e88b3154aac79b6bb344407b4f5b319513c,2023-11-08T00:00:00Z,Dat is verschrikkelijk.,10067.13921901528,10068.497453310698,SPEAKER_26,journaal,journaal2023-11-08
d5facc0c12cdeb722c26830c18c7a264211cab0a5c5e8a8be5f774d8,2023-11-08T00:00:00Z,U meent het dus beter te weten wat goed is voor een land dan zij zelf?,10069.719864176572,10073.98132427844,SPEAKER_126,journaal,journaal2023-11-08
57d386c6249eaf4c8f33b8a31de7d530c1813dba8b12aa73daa0976d,2023-11-08T00:00:00Z,"Om te beginnen, Oekraïne is een zeer verdeeld land.

 De helft van Oekraïne, de oostelijke helft, is gewoon Russisch.

 Pro-Russisch. Die worden al sinds 2014 gebombardeerd door Kiev.

 Door het regime van Zelenskyj.

 En op een gegeven moment heeft Rusland gezegd...

 nu gaan wij iets doen.

 Niet met de bedoeling om daar een grote oorlog te voeren...

 maar met de bedoeling om de Russische bevolking...

 daar Russische minderheden te beschermen.

 Om het geostrategische belang van de Krim te beschermen.

 En om te voorkomen dat vanuit Oekraïne een regimechange operatie...

 door Amerika geleid zou worden om Rusland op te knippen.

 Dat is nog steeds het doel van het Amerikaanse State Department.

 En ik begrijp niet waarom het zo moeilijk is voor journalisten...

 in Nederland om te begrijpen dat het Westen dit heeft veroorzaakt.",10075.06791171477,10122.877758913412,SPEAKER_26,journaal,journaal2023-11-08
66588a17a396c49b85b0520ed40794d7c1870ec1b88943ccfa03a79f,2023-11-08T00:00:00Z,"Uw standpunt is helder.

 Eh, iets lichters.",10123.913412563666,10128.140916808152,SPEAKER_126,journaal,journaal2023-11-08
23abc3c8cc4d86788755075e2cf0cc427e18d6f94b9c273c4e2fdeb4,2023-11-08T00:00:00Z,"Meneer Baudet, u heeft muziek voor ons meegenomen.

 Dat is zoals we ook wel van u verwacht hadden, een klassiek stuk.

 Het hele stuk duurt bijna 20 minuten, daar hebben we echt geen tijd voor.

 Dus we laten een stukje horen.",10128.938879456706,10140.772495755518,SPEAKER_126,journaal,journaal2023-11-08
ea0633dea2478f5a86c5bf3808795ff54d339d47b152873f6697b694,2023-11-08T00:00:00Z,Wie speelt dit?,10217.173174872669,10217.971137521225,SPEAKER_26,journaal,journaal2023-11-08
059d92c7d9cb5731f371d19c509358798dd83640ce85c7dcc6d7413b,2023-11-08T00:00:00Z,"Dat hebben we nog opgezocht en ik heb het vergeten op te schrijven wie het heeft gespeeld.

 En de instructeur weet het dus die zoekt het nu eventjes op.

 Het is in ieder geval een stukje uit de Suite Berg en Mask van Claude Debussy.

 En het bekende Claire de Lune.",10220.04244482173,10232.385398981323,SPEAKER_126,journaal,journaal2023-11-08
70867499d87f1b81058706eeaac01ec97b38858b03900b572c04d8c5,2023-11-08T00:00:00Z,"Klassieke muziek is heel belangrijk voor u.

 Waarom heeft u dit nummer uitgekozen?",10233.132427843804,10237.275042444824,SPEAKER_126,journaal,journaal2023-11-08
bffc6ab44ef327c3fe7190431ac133f75f589b6ddbfa6c883f5e5c18,2023-11-08T00:00:00Z,"Ja, ik vind het mooi en ik dacht het is ook ochtend...

 dus we moeten iets doen wat nog een heel klein beetje zacht op de maag is.",10237.784380305602,10248.106960950763,SPEAKER_26,journaal,journaal2023-11-08
48f17406f7673be0dff901a9afb762049725f843562fb989cc54c68e,2023-11-08T00:00:00Z,"Zacht op de maag.

 En niet meteen met allemaal tuba's en trombones.

 Dat is dan misschien wat te veel geweld voor de ochtend.",10248.786078098474,10254.286926994908,SPEAKER_26,journaal,journaal2023-11-08
079c1de268bc04f2e81d259b89522fc68bad3b0337038ce97bb745da,2023-11-08T00:00:00Z,"Een luisteraarsvraag is gekomen, niet specifiek over dit nummer hoor.

 Maar beste meneer Baudet, hoe kijkt u en uw partij...

 naar de noodleidende kunst- en cultuursector?

 Bijvoorbeeld subsidies en toegankelijkheid voor iedereen...

 van bijvoorbeeld klassieke muziek? Vraag ik Martijn.",10250.02546689304,10270.229202037352,SPEAKER_126,journaal,journaal2023-11-08
5007e086bfe8814b512026772d518329a1ae31e32c1f324a1fc14984,2023-11-08T00:00:00Z,"Ja, wij vinden het cultuurbeleid heel belangrijk.

 Dus we willen op zich steun voor de cultuursector.

 Tegelijkertijd is er een probleem.

 Dat is namelijk dat vrijwel de hele cultuursector geïnfecteerd is...

 met cultuur-Marxistische ideeën.

 Dus op het moment dat je nu meer geld gaat geven aan de cultuursector...

 dan geef je ook meer geld aan de ondermijning van onze eigen geschiedenis...

 onze architectuur, onze tradities.

 Dus je moet een soort twee-sporen-beleid voeren.

 Aan de ene kant moet je de traditionele kunsten en esthetiek verdedigen.

 En aan de andere kant moet je dat wel sturen.

 Het vergt wel wat intelligent beleid.",10269.533106960953,10313.149405772496,SPEAKER_26,journaal,journaal2023-11-08
f2d4c776109f76dc1d3bf7b93f8a220ed69beefb1518356b9a223739,2023-11-08T00:00:00Z,"Ik zit meteen weer te denken aan het thema vrijheid.

 Het lijkt wel alsof u vindt dat de vrijheid altijd geldt...

 voor de mensen met wie u het eens bent.",10315.37351443124,10324.79626485569,SPEAKER_126,journaal,journaal2023-11-08
7489280c852730290a07535f66edc6ba77bffc50fefb61690aa7d68c,2023-11-08T00:00:00Z,"Als je in de politiek beleid maakt, dan moet je keuzes maken.

 Er worden nu ook keuzes gemaakt.

 Er wordt nu allemaal geld gegeven aan het slavernijmuseum...

 antikolonialisme, moderne kunst. Wij zijn meer voor...",10324.79626485569,10340.687606112057,SPEAKER_26,journaal,journaal2023-11-08
70447038f3cd0aabd69912366e80561e83b2ebd94450464e663e1913,2023-11-08T00:00:00Z,Maar kunst moet ook schuren.,10340.636672325978,10341.960950764009,SPEAKER_126,journaal,journaal2023-11-08
f77ec25e8ee90baf4d52379e6fd2b4054e929caa3d42694bd5eb6324,2023-11-08T00:00:00Z,"Kunnen we het iets opleveren?

 Nou, dat is een hele moderne opvatting.

 Eigen vrijheid eerst.

 Waarom zegt u dat? Wat bedoelt u daarmee?",10342.86078098472,10351.994906621392,SPEAKER_26,journaal,journaal2023-11-08
c7e822a042748b81924e43df85b91d27e1f7e9f4c1529979d88a5135,2023-11-08T00:00:00Z,"Vanwege de vraag dat het erop lijkt dat u voor vrijheid bent...

 als het maar de vrijheid is voor mensen met wie u het eens bent.",10351.994906621392,10360.755517826829,SPEAKER_104,journaal,journaal2023-11-08
7e8f5637a276ea7d6874265d30b5bf7f01c32dc7bb8c676a2c36148b,2023-11-08T00:00:00Z,"Als iemand kleurstrepen op een doek wil kliederen...

 dan heeft iemand de vrijheid om dat te doen.

 Als het gaat om wat we belastinggeld moeten uitgeven...",10361.994906621392,10376.069609507642,SPEAKER_26,journaal,journaal2023-11-08
